Иностранное ПО,Российский аналог,Описание,Категория,Ссылка для скачивания
Microsoft PowerPoint,МойОфис Презентации,Приложение для создания и редактирования презентаций в пакете МойОфис.,"Другое (офисные пакеты, утилиты и пр.)",https://myoffice.ru/
Microsoft PowerPoint,Р7-Офис Презентации,Модуль для создания и редактирования презентаций в Р7-Офис.,"Другое (офисные пакеты, утилиты и пр.)",https://r7-office.ru/
Microsoft Project,Megaplan,"CRM-система и платформа для управления бизнес-процессами, проектами, задачами и клиентами.",Управление бизнесом,https://megaplan.ru/
Microsoft Project,PlanFix,"Универсальная платформа для автоматизации бизнеса, объединяющая управление задачами, процессами, CRM и документооборотом.",Управление бизнесом,https://planfix.ru/
Microsoft SharePoint,Р7-Офис Портал,Корпоративный портал для совместной работы и коммуникаций в рамках Р7-Офис.,"Другое (офисные пакеты, утилиты и пр.)",https://r7-office.ru/
Microsoft SharePoint,ЭОС ДЕЛО,Система электронного документооборота и управления корпоративным контентом (ECM).,"Другое (офисные пакеты, утилиты и пр.)",https://eos.ru/
Microsoft SQL Server,Postgres Pro,Российская версия системы управления базами данных PostgreSQL с дополнительными оптимизациями и функциями.,Базы данных,https://postgrespro.ru/
Microsoft SQL Server,Линтер,Статический анализатор кода для поиска ошибок и уязвимостей в программном обеспечении.,Средства разработки,-
Microsoft Teams,TrueConf,Программное обеспечение для организации видеоконференцсвязи и онлайн-встреч.,Коммуникации и коллаборация,https://trueconf.ru/
Microsoft Teams,VideoMost,"Платформа для корпоративных видео-коммуникаций, видеоконференций и совместной работы.",Коммуникации и коллаборация,https://videomost.com/
Microsoft Teams,Vinteo,"Программное обеспечение для видеоконференцсвязи и совместной работы, включая интеграцию с оборудованием.",Коммуникации и коллаборация,https://vinteo.com/
Microsoft Teams,Яндекс.Телемост,Сервис для проведения видеоконференций и онлайн-встреч от Яндекса.,Коммуникации и коллаборация,https://yandex.ru/
Microsoft Teams Voice,TrueConf Server,Серверное ПО для развертывания самостоятельной (on-premise) системы видеоконференцсвязи.,Коммуникации и коллаборация,https://trueconf.ru/
Microsoft Teams Voice,Vinteo,"Программное обеспечение для видеоконференцсвязи и совместной работы, включая интеграцию с оборудованием.",Коммуникации и коллаборация,https://vinteo.com/
Microsoft Visio,Draw.io (локал.),"Локализованная или локальная версия популярного веб-приложения для создания диаграмм, блок-схем и инфографики.","Другое (офисные пакеты, утилиты и пр.)",https://www.drawio.com/
Microsoft Visio,R7-Офис Диаграммы,Модуль для создания и редактирования диаграмм и графиков в составе офисного пакета R7-Офис.,"Другое (офисные пакеты, утилиты и пр.)",https://r7-office.ru/
Microsoft Windows,Astra Linux,"Семейство российских операционных систем, основанных на Linux, с сертификатами ФСТЭК и ориентированных на безопасность.",Операционные системы,https://astralinux.ru/
Microsoft Windows,Альт 8,"Дистрибутив операционной системы семейства ALT Linux, версия 8.",Операционные системы,https://www.altlinux.org/
Microsoft Windows,РЕД ОС,Российский сертифицированный дистрибутив операционной системы на базе Linux для корпоративного использования.,Операционные системы,https://redos.ru/
Microsoft Word,МойОфис Текст,Текстовый процессор для создания и редактирования документов в пакете МойОфис.,"Другое (офисные пакеты, утилиты и пр.)",https://myoffice.ru/
Microsoft Word,Р7-Офис Документы,Модуль для совместной работы над текстовыми документами в Р7-Офис.,"Другое (офисные пакеты, утилиты и пр.)",https://r7-office.ru/
MongoDB,ClickHouse,"Высокопроизводительная система управления базами данных, ориентированная на онлайн-аналитическую обработку (OLAP).",Базы данных,https://clickhouse.com/
MongoDB,Tarantool,"Высокопроизводительная платформа для управления данными и разработки приложений, совмещающая СУБД и сервер приложений.",Базы данных,https://tarantool.io/
Moodle,iSpring Learn,"Система дистанционного обучения (LMS) для создания, проведения и управления онлайн-курсами и тестированиями.",Образование и LMS,https://www.ispring.ru/
Moodle,Stepik PRO,"Премиум-версия платформы Stepik с расширенной аналитикой, поддержкой и функциями для бизнеса и ВУЗов.",Образование и LMS,https://stepik.org/
Moodle,"СДО ""Мирополис""",Система дистанционного обучения на базе платформы Mirapolis.,Образование и LMS,https://mirapolis.ru/
Moody’s RiskCalc,СКБ Контур РискАналитика,Сервис для анализа финансовых рисков и проверки контрагентов от СКБ Контур.,Аналитика и BI,https://kontur.ru/
Morningstar Direct,Finam PRO,Профессиональная платформа для трейдинга на финансовых рынках с расширенными инструментами анализа и торговли.,Аналитика и BI,https://www.finam.ru/
Morningstar Direct,БКС Аналитика,Сервис аналитики и новостей для трейдеров и инвесторов от брокерской компании БКС.,Аналитика и BI,https://bcs.ru/
Mozilla Firefox,Atom,"Текстовый редактор с открытым исходным кодом, разработанный GitHub, известный своей гибкостью и поддержкой плагинов.",Средства разработки,https://github.com/atom/atom
Mozilla Firefox,Sputnik,Российская интернет-поисковая система и портал.,"Другое (офисные пакеты, утилиты и пр.)",https://sputnik.ru/
MySQL,MariaDB (рос. сборка),Российская версия или сборка популярной системы управления реляционными базами данных с открытым исходным кодом.,Базы данных,https://mariadb.org/
MySQL,Postgres Pro,Российская версия системы управления базами данных PostgreSQL с дополнительными оптимизациями и функциями.,Базы данных,https://postgrespro.ru/
Nagios,Monq,"Платформа для мониторинга ИТ-инфраструктуры и бизнес-сервисов, сбора метрик и оповещения о проблемах.",Безопасность,-
Nagios,Zabbix RU,Российская версия или сообщество вокруг системы мониторинга ИТ-инфраструктуры Zabbix.,Управление бизнесом,https://zabbix.com/
Netflix,Start.ru,"Платформа или сервис для создания и продвижения сайтов (возможно, устаревшее или нишевое решение).","Другое (офисные пакеты, утилиты и пр.)",https://start.ru/
Netflix,Кинопоиск HD,"Онлайн-кинотеатр с подпиской, интегрированный с базой данных фильмов Кинопоиск.","Другое (офисные пакеты, утилиты и пр.)",https://kinopoisk.ru/
NICE inContact,Naumen Contact Center,"Платформа для построения корпоративного контакт-центра, управляющая всеми каналами связи с клиентами.",Коммуникации и коллаборация,https://www.naumen.ru/
NICE inContact,OKtell,"Платформа для организации колл-центров и многоканальных коммуникаций с клиентами (телефония, чаты, email).",Коммуникации и коллаборация,https://oktell.ru/
Notion,Bitrix24,"Многофункциональная платформа для управления бизнес-процессами, включающая CRM, задачи, коммуникации и инструменты продуктивности.",Управление бизнесом,https://www.bitrix24.ru/
Notion,Платформа WEEEK,Базовая платформа для управления задачами и проектами WEEEK.,Управление проектами,https://weekme.ru/
Notion Enterprise,Bitrix24,"Многофункциональная платформа для управления бизнес-процессами, включающая CRM, задачи, коммуникации и инструменты продуктивности.",Управление бизнесом,https://www.bitrix24.ru/
Notion Enterprise,Платформа WEEEK,Базовая платформа для управления задачами и проектами WEEEK.,Управление проектами,https://weekme.ru/
NVIDIA CUDA,Yadro Compute SDK,"Набор инструментов для разработчиков, работающих с вычислительными решениями и оборудованием от YADRO.",Средства разработки,https://yadro.com/
NVIDIA CUDA,Компилятор «Эльбрус»,"Компилятор для процессоров архитектуры «Эльбрус», обеспечивающий оптимизацию кода для данной платформы.",Средства разработки,https://mcst.ru/
NX Siemens,nanoCAD,"Базовая российская система автоматизированного проектирования (САПР), совместимая с форматом DWG.",CAD/CAM/CAE/PLM,https://nanocad.ru/
NX Siemens,Компас-3D,Российская система трехмерного твердотельного параметрического моделирования (САПР).,CAD/CAM/CAE/PLM,https://ascon.ru/
OBS Studio,Movavi Screen Recorder,"Утилита для записи видео с экрана компьютера, часто с возможностью захвата звука и веб-камеры.",Мультимедиа и графика,https://www.movavi.ru/
OBS Studio,TrueConf Studio,Клиентское приложение для участия в видеоконференциях и многопользовательских видеочатах.,Коммуникации и коллаборация,https://trueconf.ru/
Omnitracs,RuTrack,"Система телематики и мониторинга транспорта для контроля расхода топлива, маршрутов и стиля вождения.",Транспорт и телематика,-
Omnitracs,Wialon Transport,Специализированное решение для мониторинга общественного и коммерческого транспорта.,Транспорт и телематика,https://gurtam.com/
OneDrive,Р7-Облако,Облачная платформа от компании Р7 для размещения ИТ-инфраструктуры и приложений.,Облачные платформы и инфраструктура,https://r7-office.ru/
OneDrive,Яндекс.Диск,Облачное хранилище файлов с возможностью синхронизации и общего доступа.,"Другое (офисные пакеты, утилиты и пр.)",https://yandex.ru/
OpenAI GPT,GigaChat,"Многофункциональная нейросетевая модель (генеративный ИИ) от Сбера, способная вести диалог и решать различные задачи.",Искусственный интеллект (AI),https://cloud.gigachat.ru/
OpenAI GPT,YaLM,"Большая языковая модель (LLM) от Яндекса, аналогичная GPT, для генерации и понимания текста.",Искусственный интеллект (AI),https://yandex.ru/
OpenAI Whisper,Silero Speech,Платформа для управления облачными ресурсами и сервисами Selectel.,Искусственный интеллект (AI),https://silero.ai/
OpenAI Whisper,Яндекс SpeechKit,Технология распознавания и синтеза речи от Яндекса.,Искусственный интеллект (AI),https://yandex.ru/
OpenCascade,T-FLEX API,Программный интерфейс для автоматизации и интеграции систем T-FLEX с другим ПО.,CAD/CAM/CAE/PLM,https://tflex.com/
OpenCascade,Компас API,Программный интерфейс для автоматизации и интеграции систем КОМПАС-3D с другим ПО.,CAD/CAM/CAE/PLM,https://ascon.ru/
OpenEdX,Stepik PRO,"Премиум-версия платформы Stepik с расширенной аналитикой, поддержкой и функциями для бизнеса и ВУЗов.",Образование и LMS,https://stepik.org/
OpenFOAM,FlowVision,Программный комплекс для вычислительной гидродинамики (CFD) для моделирования задач течения жидкости и газа.,CAD/CAM/CAE/PLM,https://flowvision.ru/
OpenFOAM,ЛОГОС CFD,Модуль вычислительной гидродинамики (Computational Fluid Dynamics) в ЛОГОС.,CAD/CAM/CAE/PLM,https://logos-engineering.ru/
OpenModelica,ЛОГОС Modelica,Поддержка языка Modelica для моделирования сложных физических систем в ЛОГОС.,CAD/CAM/CAE/PLM,https://logos-engineering.ru/
OpenStack,SberCloud Advanced,Облачная инфраструктура и сервисы от Сбербанка.,Облачные платформы и инфраструктура,https://sbercloud.ru/
OpenStack,Selectel Cloud Platform,"Публичное облако от компании Selectel для размещения инфраструктуры, хранения данных и других сервисов.",Облачные платформы и инфраструктура,https://selectel.ru/
OpenStreetMap,NextGIS Open,Открытая и бесплатная ГИС-платформа для настольного использования и обработки пространственных данных.,Геоинформационные системы (ГИС),https://nextgis.com/
Oracle BI,RuData BI,Платформа бизнес-аналитики для визуализации данных и поддержки принятия решений.,Аналитика и BI,-
Oracle BI,Visiology BI,Решение для бизнес-аналитики (BI) и создания интерактивных дашбордов.,Аналитика и BI,https://visiology.ru/
Oracle Business Intelligence,Polymatica BI,"Модуль бизнес-аналитики платформы Polymatica для создания отчетов, дашбордов и визуализации данных.",Аналитика и BI,https://polymatica.com/
Oracle Business Intelligence,Visiology BI,Решение для бизнес-аналитики (BI) и создания интерактивных дашбордов.,Аналитика и BI,https://visiology.ru/
Oracle Cerner Command Center,1С:Здравоохранение,"Семейство программных продуктов для оптимизации работы системы здравоохранения. Они включают в себя инструменты для учёта пациентов, медицинских карт, записи на приём, а также для контроля над продажей, хранением и списанием лекарств.",Здравоохранение и медицина,https://1c.ru/
Oracle Cerner Command Center,Галактика Медицина,Отраслевое решение для автоматизации медицинских учреждений и клиник.,Здравоохранение и медицина,https://galaktika.ru/
Oracle Cloud for Defense,Ростелеком Secure,Пакет сервисов и решений для кибербезопасности от Ростелекома.,Безопасность,https://rt.ru/
Oracle Cloud for Defense,СберCloud Protect,Решения для безопасности в облаке Сбера.,Безопасность,https://sbercloud.ru/
Oracle Database,ClickHouse,"Высокопроизводительная система управления базами данных, ориентированная на онлайн-аналитическую обработку (OLAP).",Базы данных,https://clickhouse.com/
Oracle Database,Postgres Pro,Российская версия системы управления базами данных PostgreSQL с дополнительными оптимизациями и функциями.,Базы данных,https://postgrespro.ru/
Oracle Database,Линтер,Статический анализатор кода для поиска ошибок и уязвимостей в программном обеспечении.,Средства разработки,-
Oracle E-Business Suite,Галактика ERP,Комплексная система управления ресурсами предприятия (ERP) для крупного и среднего бизнеса.,ERP,https://galaktika.ru/
Oracle E-Business Suite,Парус 8,"Система управления предприятием (ERP) для автоматизации учета, планирования и оперативного управления.",Управление бизнесом,https://parus.ru/
Oracle Financials,1С:Финансы,"Программа для комплексного управления финансовыми потоками, учета и планирования бюджета компании.",Бухгалтерия и финансы,https://1c.ru/
Oracle Financials,Галактика Финансы,"Модуль для управления финансовыми потоками, учета и планирования.",Бухгалтерия и финансы,https://galaktika.ru/
Oracle FLEXCUBE,Diasoft FA#,"Платформа для автоматизации деятельности финансовых организаций, включая банки и страховые компании.",Управление бизнесом,https://diasoft.com/
Oracle FLEXCUBE,Бисквит,"Сервис для управления проектами и задачами, возможно, с фокусом на креативные индустрии.","Другое (офисные пакеты, утилиты и пр.)",-
Oracle Hyperion,PlanDesigner,Инструмент для проектирования и визуализации планировок помещений и расстановки мебели.,Управление проектами,-
Oracle Hyperion,Visiology Planning,"Система для бюджетного планирования, прогнозирования и консолидации.",Аналитика и BI,https://visiology.ru/
Oracle Insurance,Diasoft Insurance,Комплексное решение для автоматизации всех бизнес-процессов страховых компаний.,Страхование,https://diasoft.com/
Oracle Insurance,Галактика Страхование,Отраслевое решение для автоматизации деятельности страховых компаний.,Страхование,https://galaktika.ru/
Oracle Logistics,1С:Логистика,Эти системы помогают контролировать и оптимизировать весь цикл операций с товарами: от их поступления на склад до своевременной доставки потребителю.,Логистика и WMS,https://1c.ru/
Oracle Logistics,Логистика Pro,"Программный комплекс для автоматизации логистики, управления складом и транспортом.",Логистика и WMS,-
Oracle PeopleSoft,1С:Зарплата и кадры,"Программное решение для автоматизации кадрового учёта, управления персоналом и расчёта заработной платы.",Управление персоналом (HR),https://1c.ru/
Oracle PeopleSoft,Босс-Кадровик,"Программа для автоматизации кадрового учета, расчета зарплаты и подготовки отчетности в соответствии с российским законодательством.",Управление персоналом (HR),-
Oracle Primavera,1С:Управление проектами,"Инструмент для планирования, контроля и управления проектами любого масштаба в рамках предприятия.",Управление проектами,https://1c.ru/
Oracle Primavera,Spider Project,"Система управления проектами, портфелями и ресурсами для крупного бизнеса и государственных заказов.",Управление проектами,https://spiderproject.ru/
Oracle Primavera Construction,Sablono RU,Версия RuTube для создателей контента (блогеров) с расширенными возможностями монетизации и аналитики.,CAD/CAM/CAE/PLM,-
Oracle Primavera Construction,Spider Project,"Система управления проектами, портфелями и ресурсами для крупного бизнеса и государственных заказов.",Управление проектами,https://spiderproject.ru/
Oracle Procurement Cloud,Сбер АСТ,Электронная торговая площадка для государственных и коммерческих закупок.,Управление бизнесом,https://sberbank.ru/
Oracle Procurement Cloud,ТендерПро,Система для поиска и участия в государственных и коммерческих закупках (тендерах).,Управление бизнесом,https://tender.pro/
