Иностранное ПО,Российский аналог,Описание,Категория,Ссылка для скачивания
1Password,Kaspersky Password Manager,Менеджер паролей для безопасного хранения и автоматического заполнения учетных данных на сайтах и в приложениях.,Безопасность,https://www.kaspersky.ru/
1Password Business,Kaspersky Password Manager,Менеджер паролей для безопасного хранения и автоматического заполнения учетных данных на сайтах и в приложениях.,Безопасность,https://www.kaspersky.ru/
1Password Business,Passwork,Корпоративный менеджер паролей для безопасного хранения и общего доступа к учетным данным команды.,Безопасность,https://passwork.ru/
3ds Max,Blender (рос. дистрибутив),"Российская версия или сборка популярного пакета для создания 3D-графики, анимации, визуальных эффектов и игр.",Мультимедиа и графика,https://blender.org/
3ds Max,Компас-Графика,Приложение для двумерного черчения и проектирования в составе системы КОМПАС.,CAD/CAM/CAE/PLM,https://ascon.ru/
Abaqus,Fidesys,Платформа для инженерного анализа (CAE) методом конечных элементов для прочностных и мультифизических расчетов.,CAD/CAM/CAE/PLM,https://fidesys.com/
Abaqus,ЛОГОС CAE,Платформа для инженерного анализа (Computer-Aided Engineering) в ЛОГОС.,CAD/CAM/CAE/PLM,https://logos-engineering.ru/
Adobe Acrobat,Foxit PDF Editor (RU),"Российская версия популярного редактора PDF-файлов для создания, редактирования и аннотирования документов.","Другое (офисные пакеты, утилиты и пр.)",https://www.foxit.com/
Adobe Acrobat,МойОфис PDF,"Приложение для просмотра, создания и редактирования PDF-документов в экосистеме МойОфис.","Другое (офисные пакеты, утилиты и пр.)",https://myoffice.ru/
Adobe After Effects,Movavi Effects Editor,Редактор для наложения визуальных эффектов и обработки видео.,Мультимедиа и графика,https://www.movavi.ru/
Adobe Audition,Movavi Audio Editor,"Простой в использовании аудиоредактор для записи, очистки и монтажа звуковых файлов.",Мультимедиа и графика,https://www.movavi.ru/
Adobe Audition,Sound Forge (RU),Российская версия программы для профессионального редактирования аудио.,Мультимедиа и графика,https://magix.com/
Adobe Experience Cloud,Mindbox,Платформа сквозной аналитики и CRM-маркетинга для персонализации взаимодействия с клиентами во всех каналах.,Маркетинг и SMM,https://mindbox.ru/
Adobe Experience Cloud,Segmento,Решение для обнаружения и реагирования на угрозы на конечных точках (Endpoint Detection and Response).,Маркетинг и SMM,-
Adobe Illustrator,CorelDraw (RU версия),"Российская версия популярного векторного графического редактора для дизайна, макетов и иллюстраций.",Мультимедиа и графика,https://www.coreldraw.com/
Adobe Illustrator,Inkscape (рос. сборка),Российская версия или сборка популярного векторного графического редактора с открытым исходным кодом.,Мультимедиа и графика,https://inkscape.org/
Adobe InDesign,PageMaker (RU),"Российская версия классической настольно-издательской системы (DTP) для верстки, ныне во многом замененная InDesign.",Мультимедиа и графика,https://adobe.com/
Adobe InDesign,Scribus (рос. сборка),"SCADA-система, являющаяся частью программного комплекса ЛОГОС.",Мультимедиа и графика,https://scribus.net/
Adobe Photoshop,PhotoMASTER,Программа для редактирования и ретуширования фотографий с набором автоматических и ручных инструментов.,Мультимедиа и графика,-
Adobe Photoshop,Pixel Editor,"Графический редактор для работы с растровой графикой, часто с фокусом на пиксель-арт или базовое редактирование.",Мультимедиа и графика,-
Adobe Photoshop,Растр,"Программа для обработки растровой графики, возможно, специализированная для картографии или дизайна.",Мультимедиа и графика,-
Adobe Premiere Pro,Cinegy,"Пакет программ для профессионального производства, обработки и вещания видео в формате 4K и HDR.",Мультимедиа и графика,https://cinegy.com/
Adobe Premiere Pro,Movavi Video Editor,"Пользовательский видеоредактор для нелинейного монтажа видео, создания слайд-шоу и наложения эффектов.",Мультимедиа и графика,https://www.movavi.ru/
Adobe Sign,Диадок,Система электронного документооборота для юридически значимого обмена счетами-фактурами и другими документами.,"Другое (офисные пакеты, утилиты и пр.)",https://diadoc.ru/
Adobe Sign,СБИС,"Популярная система для электронного документооборота, отчетности, управления персоналом и взаимодействия с госорганами.",Управление бизнесом,https://sbis.ru/
Adobe Sign,Такском,"Провайдер услуг связи, хостинга, облачных сервисов и 1С.","Другое (офисные пакеты, утилиты и пр.)",https://taxcom.ru/
Adobe Stock,Photogenica,Онлайн-библиотека стоковых фотографий и изображений для использования в дизайне и рекламе.,Мультимедиа и графика,-
Adobe Stock,Лори,Система для автоматизации туристического бизнеса: туроператоров и турагентств.,"Другое (офисные пакеты, утилиты и пр.)",-
Adyen,PayAnyWay,"Платежный сервис-агрегатор, предоставляющий интернет-магазинам различные способы приема платежей.",Электронная коммерция и платежи,https://payanyway.ru/
Adyen,UnitPay,Платежный шлюз и агрегатор для приема платежей на сайтах и в интернет-магазинах.,Электронная коммерция и платежи,https://unitpay.ru/
Allscripts,1С:Поликлиника,"Прикладное решение для автоматизации основных процессов медицинских организаций, оказывающих помощь в амбулаторно-поликлинических условиях.",Здравоохранение и медицина,https://1c.ru/
Allscripts,МИС Галактика Здравоохранение,"Медицинская информационная система в рамках экосистемы ""Галактика"".",Здравоохранение и медицина,https://galaktika.ru/
Amazon Polly,Silero TTS,Модели и библиотеки для распознавания и синтеза русской речи от сообщества Silero.,Искусственный интеллект (AI),https://silero.ai/
Amazon Polly,Яндекс SpeechKit TTS,Модуль синтеза речи (Text-to-Speech) в рамках Яндекс SpeechKit.,Искусственный интеллект (AI),https://yandex.ru/
Anaplan,Polymatica Plan,"Решение для бюджетного планирования, прогнозирования и консолидации финансовых данных.",Аналитика и BI,https://polymatica.com/
Anaplan,RuData Plan,Платформа для интеграции данных из различных источников в единое информационное пространство.,Аналитика и BI,-
ANSYS,CAE Fidesys,"Программный комплекс для инженерного анализа (CAE) методом конечных элементов, включающий прочностные и тепловые расчеты.",CAD/CAM/CAE/PLM,https://fidesys.com/
ANSYS,ЛОГОС,Многофункциональный программный комплекс для инженерного анализа (CAE) и многодисциплинарного моделирования.,CAD/CAM/CAE/PLM,https://logos-engineering.ru/
ANSYS Fluent,FlowVision,Программный комплекс для вычислительной гидродинамики (CFD) для моделирования задач течения жидкости и газа.,CAD/CAM/CAE/PLM,https://flowvision.ru/
ANSYS Fluent,ЛОГОС CFD,Модуль вычислительной гидродинамики (Computational Fluid Dynamics) в ЛОГОС.,CAD/CAM/CAE/PLM,https://logos-engineering.ru/
Apache Hadoop,RuHadoop,Инструмент для статистического анализа данных.,Аналитика и BI,-
Apache Hadoop,Yadro DataLake,Решение для построения и управления дата-озером (Data Lake) для хранения и обработки неструктурированных данных.,Аналитика и BI,https://yadro.com/
Apache Kafka,Tarantool Stream,Модуль для обработки потоковых данных в Tarantool.,Базы данных,https://tarantool.io/
Apache Kafka,Сбер Kafka,Сервис обмена сообщениями на базе Apache Kafka в экосистеме Сбера.,Аналитика и BI,https://sbercloud.ru/
Apple Music,VK Музыка,Сервис потоковой передачи музыки и подкастов внутри социальной сети VK.,"Другое (офисные пакеты, утилиты и пр.)",https://vk.com/
Apple Music,Яндекс.Музыка,Стриминговый сервис для прослушивания музыки и подкастов.,"Другое (офисные пакеты, утилиты и пр.)",https://yandex.ru/
ArcGIS,NextGIS,Платформа для разработки и использования геоинформационных систем (ГИС) и веб-карт.,Геоинформационные системы (ГИС),https://nextgis.com/
ArcGIS,Panorama GIS,"Отечественная геоинформационная система для работы с картами, космическими снимками и геоданными.",Геоинформационные системы (ГИС),https://gispana.ru/
ArcGIS Defense,NextGIS Secure,Решение для обеспечения безопасности и контроля доступа к геоданным.,Геоинформационные системы (ГИС),https://nextgis.com/
ArcGIS Defense,Panorama GIS Военная,"Специализированная версия ГИС ""Панорама"" для применения в органах управления и вооруженных силах.",Геоинформационные системы (ГИС),https://gispana.ru/
ArcGIS Online,NextGIS Cloud,"Облачный сервис для хостинга геоданных, создания и публикации веб-карт.",Геоинформационные системы (ГИС),https://nextgis.com/
ArcGIS Online,Панорама GIS,"Отечественная геоинформационная система для работы с картами, космическими снимками и геоданными.",Геоинформационные системы (ГИС),https://gispana.ru/
ArcGIS Pro,NextGIS,Платформа для разработки и использования геоинформационных систем (ГИС) и веб-карт.,Геоинформационные системы (ГИС),https://nextgis.com/
ArcGIS Pro,Panorama GIS,"Отечественная геоинформационная система для работы с картами, космическими снимками и геоданными.",Геоинформационные системы (ГИС),https://gispana.ru/
ArchiCAD,nanoCAD Архитектура,Специализированное приложение для архитектурно-строительного проектирования в среде nanoCAD.,CAD/CAM/CAE/PLM,https://nanocad.ru/
ArchiCAD,Renga,"Многофункциональная BIM-система для архитекторов, инженеров и проектировщиков.",CAD/CAM/CAE/PLM,https://rengabim.com/
ArchiFM,1С:Управление недвижимостью,"Программа для автоматизации управления коммерческой и жилой недвижимостью, арендой, обслуживанием и эксплуатацией.",Управление недвижимостью,https://1c.ru/
ArchiFM,Парус:Эксплуатация,Модуль для управления эксплуатацией и обслуживанием основных фондов и оборудования.,Управление бизнесом,https://parus.ru/
Asana,Bitrix24,"Многофункциональная платформа для управления бизнес-процессами, включающая CRM, задачи, коммуникации и инструменты продуктивности.",Управление бизнесом,https://www.bitrix24.ru/
Asana,WEEEK,"Система управления задачами и проектами, построенная на принципах Канбан и Agile.",Управление проектами,https://weekme.ru/
Aspen HYSYS,AnyLogic,"Многоцелевая среда имитационного моделирования для бизнес-процессов, логистики и сложных динамических систем.",Средства разработки,https://www.anylogic.ru/
Aspen HYSYS,Logos Process,"Система управления бизнес-процессами (BPMS) для их моделирования, автоматизации и контроля исполнения.",CAD/CAM/CAE/PLM,-
Atlassian Confluence,Bitrix24 Wiki,"Инструмент для создания и ведения корпоративной базы знаний, документации и внутренних порталов внутри Bitrix24.",Коммуникации и коллаборация,https://www.bitrix24.ru/
Atlassian Confluence,ЭОС Корпоративный портал,Платформа для построения корпоративного портала и интранета.,"Другое (офисные пакеты, утилиты и пр.)",https://eos.ru/
AutoCAD,nanoCAD,"Базовая российская система автоматизированного проектирования (САПР), совместимая с форматом DWG.",CAD/CAM/CAE/PLM,https://nanocad.ru/
AutoCAD,Компас-3D,Российская система трехмерного твердотельного параметрического моделирования (САПР).,CAD/CAM/CAE/PLM,https://ascon.ru/
Autodesk Civil 3D,Credo Civil,Программный комплекс для проектирования и изысканий в области промышленного и гражданского строительства.,CAD/CAM/CAE/PLM,https://credo-dialogue.com/
Autodesk Civil 3D,nanoCAD Геоника,"Решение для создания и обработки геоподосновы, генпланов и выполнения геодезических задач.",CAD/CAM/CAE/PLM,https://nanocad.ru/
Autodesk Fusion 360,nanoCAD,"Базовая российская система автоматизированного проектирования (САПР), совместимая с форматом DWG.",CAD/CAM/CAE/PLM,https://nanocad.ru/
Autodesk Fusion 360,Компас-3D,Российская система трехмерного твердотельного параметрического моделирования (САПР).,CAD/CAM/CAE/PLM,https://ascon.ru/
Autodesk Inventor,T-FLEX CAD,Базовая параметрическая система САПР для 2D-черчения и 3D-моделирования.,CAD/CAM/CAE/PLM,https://tflex.com/
Autodesk Inventor,Компас-3D,Российская система трехмерного твердотельного параметрического моделирования (САПР).,CAD/CAM/CAE/PLM,https://ascon.ru/
Autodesk Revit,nanoCAD BIM,Платформа для информационного моделирования зданий (BIM) на базе nanoCAD.,CAD/CAM/CAE/PLM,https://nanocad.ru/
Autodesk Revit,Renga Architecture,Приложение для архитектурного проектирования в среде Renga.,CAD/CAM/CAE/PLM,https://rengabim.com/
Autodesk Robot Structural Analysis,SCAD Office,Программный комплекс для расчета строительных конструкций методом конечных элементов.,CAD/CAM/CAE/PLM,https://scadsoft.com/
Autodesk Robot Structural Analysis,ЛИРА-САПР,Программный комплекс для расчета и проектирования строительных конструкций.,CAD/CAM/CAE/PLM,https://liraland.ru/
AutoPlant,nanoCAD СПДС,Модуль для автоматизации оформления проектной и рабочей документации по российским стандартам (СПДС).,CAD/CAM/CAE/PLM,https://nanocad.ru/
AutoPlant,Renga Mechanical,Приложение для проектирования машиностроительных изделий и конструкций в Renga.,CAD/CAM/CAE/PLM,https://rengabim.com/
Avaloq,R-Style Softlab RS-Bank,Решение для автоматизации банковской деятельности от компании R-Style Softlab.,Управление бизнесом,https://r-style.ru/
Avaya Aura,TrueConf Server,Серверное ПО для развертывания самостоятельной (on-premise) системы видеоконференцсвязи.,Коммуникации и коллаборация,https://trueconf.ru/
Avaya Aura,Ростелеком Виртуальная АТС,Облачная АТС для бизнеса от Ростелекома.,Коммуникации и коллаборация,https://rt.ru/
AVEVA,nanoCAD Engineering,"Модуль nanoCAD для решения инженерных задач, таких как расчеты и проектирование механизмов.",CAD/CAM/CAE/PLM,https://nanocad.ru/
AVEVA,Renga,"Многофункциональная BIM-система для архитекторов, инженеров и проектировщиков.",CAD/CAM/CAE/PLM,https://rengabim.com/
AVEVA PDMS,nanoCAD Engineering,"Модуль nanoCAD для решения инженерных задач, таких как расчеты и проектирование механизмов.",CAD/CAM/CAE/PLM,https://nanocad.ru/
AVEVA PDMS,Renga BIM,Базовая платформа для информационного моделирования зданий (BIM) от Renga.,CAD/CAM/CAE/PLM,https://rengabim.com/
AVEVA System Platform,SCADA ЛОГОС,Универсальная SCADA-система для сбора данных и диспетчерского управления технологическими процессами.,Управление бизнесом,-
AVEVA System Platform,Trace Mode Enterprise,Корпоративная версия SCADA Trace Mode для управления распределенными и сложными объектами.,Управление бизнесом,https://tracenode.com/
AWS,SberCloud,"Платформа для управления данными, обеспечивающая их доступность, качество и согласованность в масштабах предприятия.",Облачные платформы и инфраструктура,https://sbercloud.ru/
AWS,Selectel Cloud,Платформа для управления сегментами клиентов и запуска персонализированных маркетинговых кампаний.,Облачные платформы и инфраструктура,https://selectel.ru/
AWS Connect,Naumen Cloud CC,Облачный сервис для организации многоканального контакт-центра от компании Naumen.,Коммуникации и коллаборация,https://www.naumen.ru/
AWS Connect,TrueConf CC,Серверное решение для развертывания корпоративной системы видеосвязи.,Коммуникации и коллаборация,https://trueconf.ru/
AWS GovCloud,Ростелеком ГосОблако,Защищенное облако для размещения информационных систем государственных органов.,Облачные платформы и инфраструктура,https://rt.ru/
AWS GovCloud,СберCloud Gov,Защищенное облако от Сбера для государственных информационных систем.,Облачные платформы и инфраструктура,https://sbercloud.ru/
AWS IoT,МТС IoT Hub,"Платформа для подключения, управления и мониторинга устройств интернета вещей (IoT) от МТС.",Облачные платформы и инфраструктура,https://mts.ru/
AWS IoT,Ростелеком IoT Platform,Комплексная платформа для разработки и эксплуатации решений в области интернета вещей.,Облачные платформы и инфраструктура,https://rt.ru/
AWS IoT FleetWise,МТС Логистика,Решение для управления логистикой и цепями поставок от МТС.,Логистика и WMS,https://mts.ru/
AWS IoT FleetWise,Ростелеком IoT,Платформа интернета вещей для подключения и управления IoT-устройствами.,Облачные платформы и инфраструктура,https://rt.ru/
AWS KMS,VipNet CSP,"Криптопровайдер, средство криптографической защиты информации, используемое для электронной подписи и шифрования.",Безопасность,https://infotecs.ru/
AWS KMS,КриптоПро CSP,"Средство криптографической защиты информации, российский криптопровайдер для электронной подписи и шифрования.",Безопасность,https://cryptopro.ru/
AWS Rekognition,VisionLab AI,Решения на основе искусственного интеллекта для задач компьютерного зрения.,Искусственный интеллект (AI),https://visionlabs.ai/
AWS Rekognition,Сбер Vision,Сервисы компьютерного зрения и распознавания образов от Сбера.,Искусственный интеллект (AI),https://sberdevices.ru/
Azure,VK Cloud,"Публичное облако от VK для размещения виртуальной инфраструктуры, приложений и данных.",Облачные платформы и инфраструктура,https://mcs.mail.ru/
