Иностранное ПО,Российский аналог,Описание,Категория,Ссылка для скачивания
Oracle SCM Cloud,Cleverence Cloud,"Облачное решение для автоматизации складской и розничной логистики, управления мобильными сотрудниками.",Облачные платформы и инфраструктура,https://cleverence.ru/
Oracle SCM Cloud,Логистика Pro Cloud,"Облачная версия системы ""Логистика Pro"".",Логистика и WMS,-
OSIsoft PI System,SCADA Trace Mode,Универсальная SCADA-система для сбора данных и диспетчерского управления технологическими процессами.,Управление бизнесом,https://tracenode.com/
OSIsoft PI System,Энергомониторинг RuEnergy,"Система для мониторинга и учета потребления энергоресурсов (электроэнергия, тепло, вода, газ).",Управление бизнесом,-
Outlook Exchange Server,CommuniGate Pro,"Серверное ПО для организации корпоративной коммуникации: почта, календари, контакты, видеоконференции и VoIP.",Коммуникации и коллаборация,https://communigate.com/
Outlook Exchange Server,Почтовый Сервер МойОфис,Серверное решение для развертывания корпоративной почтовой системы от МойОфис.,"Другое (офисные пакеты, утилиты и пр.)",https://myoffice.ru/
Palantir Foundry,RuData Fusion,"Решение для финансового анализа, планирования и консолидации отчетности.",Аналитика и BI,-
Palantir Foundry,Сбер Аналитика,Платформа для бизнес-аналитики и анализа данных от Сбера.,Аналитика и BI,https://sberbank.ru/
Palantir Gotham,RuAnalytica,"Платформа для анализа данных и бизнес-аналитики, ориентированная на российский рынок.",Аналитика и BI,-
Palantir Gotham,Сфера Аналитика,"Система бизнес-аналитики и отчетности, возможно, отраслевая.",Аналитика и BI,-
Palo Alto Cortex,Positive Technologies MaxPatrol,Система для управления уязвимостями и соответствия требованиям стандартов безопасности.,Безопасность,https://ptsecurity.com/
Palo Alto Networks,Positive Technologies MaxPatrol,Система для управления уязвимостями и соответствия требованиям стандартов безопасности.,Безопасность,https://ptsecurity.com/
PayPal,VK Pay,Платежный сервис и электронный кошелек внутри экосистемы VK.,Электронная коммерция и платежи,https://vk.com/
PayPal,ЮMoney,Электронный кошелек и платежная система (ранее Яндекс.Деньги).,Электронная коммерция и платежи,https://yoomoney.ru/
Philips IntelliSpace,МедКонтроль,Система для контроля качества медицинской помощи и управления клиническими процессами.,Здравоохранение и медицина,-
Philips IntelliSpace,Телемедика,Платформа для оказания удаленных медицинских консультаций (телемедицина).,Здравоохранение и медицина,-
Photoshop Lightroom,Movavi Photo Manager,"Программа для организации, сортировки и базового редактирования коллекций фотографий.",Мультимедиа и графика,https://www.movavi.ru/
Power BI,RuData BI,Платформа бизнес-аналитики для визуализации данных и поддержки принятия решений.,Аналитика и BI,-
Power BI,Платформа Visiology,Базовая платформа для бизнес-аналитики и визуализации данных от компании Visiology.,Аналитика и BI,https://visiology.ru/
Power BI Dataflows,RuData BI Flow,Облачная версия платформы бизнес-аналитики RuData.,Аналитика и BI,-
Power BI Dataflows,Visiology Flow,Модуль для автоматизации бизнес-процессов на основе данных.,Аналитика и BI,https://visiology.ru/
Power BI Service,RuData BI Cloud,Платформа бизнес-аналитики для визуализации данных и поддержки принятия решений.,Аналитика и BI,-
Primavera,Spider Project,"Система управления проектами, портфелями и ресурсами для крупного бизнеса и государственных заказов.",Управление проектами,https://spiderproject.ru/
Pro Tools,Ardour (RU),Российская локализация или сборка профессиональной цифровой аудио рабочей станции (DAW) с открытым исходным кодом.,Мультимедиа и графика,https://ardour.org/
Pro Tools,Sound Forge Pro,Профессиональная версия аудиоредактора Sound Forge с расширенным набором инструментов.,Мультимедиа и графика,https://magix.com/
PTC Creo,T-FLEX,Семейство систем автоматизированного проектирования и управления (CAD/CAM/CAE/PDM/PLM).,CAD/CAM/CAE/PLM,https://tflex.com/
PTC Creo,Компас-3D,Российская система трехмерного твердотельного параметрического моделирования (САПР).,CAD/CAM/CAE/PLM,https://ascon.ru/
PTC ThingWorx,Positive IoT,Платформа для мониторинга и обеспечения безопасности интернета вещей (IoT).,Безопасность,https://ptsecurity.com/
PTC ThingWorx,МТС IoT Платформа,"Комплексное решение для построения IoT-проектов, включая подключение устройств, сбор данных и аналитику.",Облачные платформы и инфраструктура,https://mts.ru/
PTC Windchill,T-FLEX PLM,Система управления жизненным циклом изделия (PLM).,CAD/CAM/CAE/PLM,https://tflex.com/
PTC Windchill,ЛОЦМАН:PLM,"Полное название PLM-системы ""ЛОЦМАН"" для управления жизненным циклом изделий.",CAD/CAM/CAE/PLM,https://lotzman.ru/
PyCharm,Thonny (рос. версия),"Российская версия простой IDE для начинающих программистов, изучающих язык Python.",Средства разработки,https://thonny.org/
PyCharm,Wing IDE,Среда разработки (IDE) для языка Python с мощным отладчиком и поддержкой удаленной разработки.,Средства разработки,https://wingware.com/
PyTorch,AI Hub RU,"Российский каталог и платформа для работы с моделями искусственного интеллекта, их распространения и использования.",Облачные платформы и инфраструктура,-
PyTorch,OpenNetLab,Платформа или сообщество для исследований и разработок в области компьютерных сетей и распределенных систем.,Средства разработки,-
PyTorch,SberTorch,Библиотеки и сервисы для обработки естественного языка (NLP) от Сбера.,Средства разработки,https://sbercloud.ru/
QGIS,NextGIS,Платформа для разработки и использования геоинформационных систем (ГИС) и веб-карт.,Геоинформационные системы (ГИС),https://nextgis.com/
QGIS,ГеоПлан,"Программа для создания геоподосновы, генпланов и выполнения инженерно-геодезических задач.",Геоинформационные системы (ГИС),-
QuickBooks,1С:Бухгалтерия,Программа для автоматизации бухгалтерского и налогового учёта,Бухгалтерия и финансы,https://1c.ru/
QuickBooks,БухСофт,"Программы для автоматизации бухгалтерского и налогового учета, подготовки отчетности.",Бухгалтерия и финансы,-
Reddit,Pikabu,"Популярная российская платформа для блогов и социальных новостей, где пользователи публикуют и обсуждают контент.","Другое (офисные пакеты, утилиты и пр.)",https://pikabu.ru/
Refinitiv Eikon,Finam Terminal,Торговый терминал для частных инвесторов и трейдеров для работы на фондовом и валютном рынках.,Аналитика и BI,https://www.finam.ru/
Refinitiv Eikon,RuMarket,Программный комплекс для автоматизации логистики и управления цепями поставок.,Электронная коммерция и платежи,-
Revit MEP,nanoCAD MEP,"Специализированное решение для проектирования инженерных систем: отопления, вентиляции, водоснабжения и электроснабжения.",CAD/CAM/CAE/PLM,https://nanocad.ru/
Revit MEP,Renga MEP,"Приложение для проектирования инженерных систем (механика, электрика, сантехника) в Renga.",CAD/CAM/CAE/PLM,https://rengabim.com/
RingCentral,Mango Office,"Виртуальная АТС и платформа бизнес-коммуникаций (телефония, чаты, CRM-интеграции) для компаний.",Коммуникации и коллаборация,https://www.mango-office.ru/
RingCentral,Zadarma,"Провайдер облачной АТС, виртуальных телефонных номеров и аудиоконференций.",Коммуникации и коллаборация,https://zadarma.com/
Salesforce,1С:CRM,Линейка программных продуктов фирмы «1С» для автоматизации управления взаимоотношениями с клиентами (CRM). Интегрирована с платформой «1С:Предприятие».,CRM,https://1c.ru/
Salesforce,Bitrix24 CRM,"Модуль управления взаимоотношениями с клиентами в рамках Bitrix24 для отслеживания сделок, лидов и взаимодействий.",CRM,https://www.bitrix24.ru/
Salesforce Marketing Cloud,Bitrix24 Маркетинг,"Набор инструментов для автоматизации маркетинга: email-рассылки, воронки продаж, CRM-маркетинг и управление рекламой.",Маркетинг и SMM,https://www.bitrix24.ru/
Salesforce Marketing Cloud,Mindbox,Платформа сквозной аналитики и CRM-маркетинга для персонализации взаимодействия с клиентами во всех каналах.,Маркетинг и SMM,https://mindbox.ru/
Salesforce Service Cloud,Bitrix24,"Многофункциональная платформа для управления бизнес-процессами, включающая CRM, задачи, коммуникации и инструменты продуктивности.",Управление бизнесом,https://www.bitrix24.ru/
Salesforce Service Cloud,Naumen CRM,"Система управления взаимоотношениями с клиентами, часто интегрированная с решением для контакт-центра.",CRM,https://www.naumen.ru/
SAP Analytics Cloud,RuData BI Cloud,Облачная версия платформы бизнес-аналитики RuData.,Аналитика и BI,-
SAP Analytics Cloud,Visiology Cloud,Облачная версия платформы Visiology для бизнес-аналитики.,Аналитика и BI,https://visiology.ru/
SAP Ariba,B2B-Center,"Электронная торговая площадка для организации закупочных и сбытовых процедур (тендеры, аукционы, запросы котировок).",Электронная коммерция и платежи,https://b2b-center.ru/
SAP Ariba,ТендерПро,Система для поиска и участия в государственных и коммерческих закупках (тендерах).,Управление бизнесом,https://tender.pro/
SAP BPC,1С:Бюджет,"Автоматизированная информационная система планирования, санкционирования, учёта, контроля и анализа исполнения бюджета",Бухгалтерия и финансы,https://1c.ru/
SAP BPC,Галактика Планирование,"Модуль для бюджетного планирования, финансового моделирования и консолидации.",Управление бизнесом,https://galaktika.ru/
SAP BusinessObjects,Polymatica,"Платформа для комплексной аналитики больших данных, прогнозного моделирования и бизнес-аналитики.",Аналитика и BI,https://polymatica.com/
SAP BusinessObjects,RuData Analytics,"Решение для аналитики данных, построения отчетов и дашбордов.",Аналитика и BI,-
SAP ERP,1С:ERP,Комплексное программное решение от компании «1С» для автоматизации бизнес-процессов и управления деятельностью предприятий. Расшифровывается как «планирование ресурсов предприятия».,ERP,https://1c.ru/
SAP ERP,Галактика ERP,Комплексная система управления ресурсами предприятия (ERP) для крупного и среднего бизнеса.,ERP,https://galaktika.ru/
SAP EWM,1С:WMS Логистика,"Система для управления складом и складской логистикой, разработанная на базе платформы «1С:Предприятие 8».",Логистика и WMS,https://1c.ru/
SAP EWM,Solvo.WMS,Система управления транспортом (TMS) для автоматизации логистических процессов и планирования перевозок.,Логистика и WMS,-
SAP Financials,1С:ERP,Комплексное программное решение от компании «1С» для автоматизации бизнес-процессов и управления деятельностью предприятий. Расшифровывается как «планирование ресурсов предприятия».,ERP,https://1c.ru/
SAP Financials,Парус Финансы,"Модуль управления финансами, бюджетированием и учетной политикой в системе ""Парус"".",Бухгалтерия и финансы,https://parus.ru/
SAP for Utilities,Галактика Энергия,Отраслевое решение для предприятий энергетического сектора.,Управление бизнесом,https://galaktika.ru/
SAP for Utilities,Парус Энергетика,"Отраслевое решение для предприятий энергетики на платформе ""Парус"".",Управление бизнесом,https://parus.ru/
SAP HR,1С:Зарплата и управление персоналом,"Программное решение, разработанное российской компанией «1С» для автоматизации кадрового учёта, управления персоналом и расчёта заработной платы.",Управление персоналом (HR),https://1c.ru/
SAP Learning Hub,Mirapolis Education,Платформа для организации корпоративного обучения и развития персонала.,Образование и LMS,https://mirapolis.ru/
SAP Learning Hub,Stepik PRO,"Премиум-версия платформы Stepik с расширенной аналитикой, поддержкой и функциями для бизнеса и ВУЗов.",Образование и LMS,https://stepik.org/
SAP Transportation Management,1С:Транспортная логистика,"Отраслевое решение на платформе ""1С:Предприятие 8"" для автоматизации планирования, исполнения и контроля транспортных перевозок.",Логистика и WMS,https://1c.ru/
SAP Transportation Management,АСУ-Транспорт,Автоматизированная система управления транспортными перевозками и логистикой.,Транспорт и телематика,-
SAS,Polymatica,"Платформа для комплексной аналитики больших данных, прогнозного моделирования и бизнес-аналитики.",Аналитика и BI,https://polymatica.com/
SAS,RuData BI,Платформа бизнес-аналитики для визуализации данных и поддержки принятия решений.,Аналитика и BI,-
SAS Enterprise Miner,Polymatica,"Платформа для комплексной аналитики больших данных, прогнозного моделирования и бизнес-аналитики.",Аналитика и BI,https://polymatica.com/
SAS Enterprise Miner,RuData AI,Инструменты искусственного интеллекта и машинного обучения в рамках платформы RuData.,Аналитика и BI,-
SAS Grid Manager,Polymatica Grid,Технология для распределенных вычислений и обработки данных на кластерных системах.,Аналитика и BI,https://polymatica.com/
SAS Grid Manager,RuData BI,Платформа бизнес-аналитики для визуализации данных и поддержки принятия решений.,Аналитика и BI,-
SAS Risk Management,Polymatica Risk,"Модуль для анализа и управления рисками в различных областях (финансовые, операционные).",Аналитика и BI,https://polymatica.com/
SAS Risk Management,RuData Risk,"Базовая платформа для работы с данными, объединяющая различные модули RuData.",Аналитика и BI,-
Schneider EcoStruxure,MasterSCADA,"Российская SCADA-система для сбора данных, мониторинга и диспетчеризации технологических процессов в реальном времени.",Управление бизнесом,https://masterscada.ru/
Schneider EcoStruxure,Trace Mode,Универсальная SCADA-система для сбора данных и диспетчерского управления технологическими процессами.,Управление бизнесом,https://tracenode.com/
Schneider Power Monitoring Expert,Энергософт,"Программное обеспечение для проектирования, расчета и анализа систем электроснабжения.",Управление бизнесом,-
Schneider Power Monitoring Expert,Энергоучёт,Система для автоматизации коммерческого и технического учета электроэнергии.,Управление бизнесом,-
Scopus,eLIBRARY,"Крупнейшая российская научная электронная библиотека, предоставляющая доступ к статьям, диссертациям и монографиям.",Научные исследования и данные,https://elibrary.ru/
Scopus,РИНЦ,Российский индекс научного цитирования - база данных научных публикаций и оценка цитируемости ученых и организаций.,Научные исследования и данные,https://elibrary.ru/
ServiceNow,DeskWork,"Система электронного документооборота (СЭД) для управления потоками документов, согласования и архивирования.",Управление бизнесом,-
ServiceNow,Naumen ITSM,Платформа для управления ИТ-услугами (ITSM) в соответствии с лучшими практиками ITIL.,Управление бизнесом,https://www.naumen.ru/
Siemens MindSphere,Ростелеком IIoT,Платформа промышленного интернета вещей (Industrial IoT) для мониторинга и управления производственными активами.,Облачные платформы и инфраструктура,https://rt.ru/
Siemens MindSphere,СберИндустрия,Платформа для цифровизации промышленных предприятий от Сбера.,Управление бизнесом,https://sberbank.ru/
Siemens NX,T-FLEX CAD,Базовая параметрическая система САПР для 2D-черчения и 3D-моделирования.,CAD/CAM/CAE/PLM,https://tflex.com/
Siemens NX,Компас-3D,Российская система трехмерного твердотельного параметрического моделирования (САПР).,CAD/CAM/CAE/PLM,https://ascon.ru/
Siemens Opcenter,T-FLEX MES,Система управления производственными операциями (MES).,CAD/CAM/CAE/PLM,https://tflex.com/
Siemens Opcenter,Галактика MES,"Система управления производственными операциями (MES) в рамках экосистемы ""Галактика"".",Управление бизнесом,https://galaktika.ru/
Siemens PCS 7,MasterSCADA,"Российская SCADA-система для сбора данных, мониторинга и диспетчеризации технологических процессов в реальном времени.",Управление бизнесом,https://masterscada.ru/
Siemens PCS 7,Квинт,"Система для автоматизации аптек и фармацевтических предприятий, управления товарооборотом и соблюдения регламентов.",Управление бизнесом,-
Siemens Simatic,MasterSCADA,"Российская SCADA-система для сбора данных, мониторинга и диспетчеризации технологических процессов в реальном времени.",Управление бизнесом,https://masterscada.ru/
Siemens Simatic,Trace Mode,Универсальная SCADA-система для сбора данных и диспетчерского управления технологическими процессами.,Управление бизнесом,https://tracenode.com/
Siemens Simcenter,Fidesys,Платформа для инженерного анализа (CAE) методом конечных элементов для прочностных и мультифизических расчетов.,CAD/CAM/CAE/PLM,https://fidesys.com/
Siemens Simcenter,ЛОГОС Simulation,Базовый модуль для проведения имитационного моделирования и виртуальных испытаний.,CAD/CAM/CAE/PLM,https://logos-engineering.ru/
